{
  "schema_version": "1.0",
  "jurisdiction": {
    "code": "IT",
    "name": "Italy",
    "eu_member": true
  },
  "last_verified": "2026-09-15",
  "scope": {
    "assumptions": [
      "The lender is an Italian bank or an Article 106 financial intermediary.",
      "The borrower is a natural person and the product is consumer or mortgage credit.",
      "The lender uses credit-information systems and AI or automated processing in credit assessment."
    ],
    "exclusions": [
      "Entity-specific supervisory decisions and licence conditions.",
      "Tax, employment, accounting, company-law, and product rules unrelated to credit assessment.",
      "Business lending, servicing of non-performing loans, securitisation, insurance distribution, and payment services unless separately scoped."
    ]
  },
  "entries": [
    {
      "id": "IT-TUB-120-UNDECIES",
      "title": "Mortgage creditworthiness assessment",
      "citation": "D.Lgs. 385/1993 (TUB), Article 120-undecies",
      "category": "creditworthiness",
      "status": "in_force",
      "applicability": "Consumer credit relating to residential immovable property.",
      "obligation": "Carry out a thorough creditworthiness assessment using necessary, sufficient, proportionate, and appropriately verified economic and financial information before concluding the credit agreement.",
      "open_credit_relationship": "direct",
      "open_credit_evidence": [
        "Trace each material summary fact to verified source information.",
        "Flag missing or contradictory income, expense, debt, and repayment-capacity facts."
      ],
      "finos_controls": ["FINOS-AIGF-MI-4", "FINOS-AIGF-MI-5", "FINOS-AIGF-MI-11"],
      "eu_ai_act_refs": ["Article 9", "Article 10", "Article 12", "Article 14", "Article 15"],
      "official_sources": [
        {
          "label": "Italian Banking Act",
          "url": "https://www.normattiva.it/uri-res/N2Ls?urn:nir:stato:decreto.legislativo:1993-09-01;385",
          "publisher": "Normattiva"
        }
      ]
    },
    {
      "id": "IT-TUB-124-BIS-1",
      "title": "Thorough consumer creditworthiness assessment",
      "citation": "D.Lgs. 385/1993 (TUB), Article 124-bis(1)",
      "category": "creditworthiness",
      "status": "transition",
      "applicability": "Consumer credit within TUB Title VI, Chapter II, subject to statutory exclusions and transition rules.",
      "obligation": "Assess the consumer's creditworthiness thoroughly before concluding the credit agreement, including in the consumer's interest to avoid irresponsible lending and over-indebtedness.",
      "open_credit_relationship": "direct",
      "open_credit_evidence": [
        "Verify that the internal summary contains all defined decision-critical facts.",
        "Record omissions before the lending decision proceeds."
      ],
      "finos_controls": ["FINOS-AIGF-MI-5", "FINOS-AIGF-MI-11"],
      "eu_ai_act_refs": ["Article 9", "Article 14", "Article 15"],
      "official_sources": [
        {
          "label": "Legislative Decree 212/2025",
          "url": "https://www.normattiva.it/atto/caricaDettaglioAtto?atto.codiceRedazionale=26G00009&atto.dataPubblicazioneGazzetta=2026-01-09&tipoDettaglio=multivigenza",
          "publisher": "Normattiva"
        }
      ],
      "notes": "General adaptation deadline: 20 November 2026 or, if later, 90 days after the relevant Bank of Italy implementing provisions enter into force."
    },
    {
      "id": "IT-TUB-124-BIS-1-BIS",
      "title": "Necessary and proportionate creditworthiness information",
      "citation": "D.Lgs. 385/1993 (TUB), Article 124-bis(1-bis)",
      "category": "credit_data",
      "status": "transition",
      "applicability": "Consumer creditworthiness assessments under Article 124-bis.",
      "obligation": "Use necessary and proportionate economic and financial information, appropriately verify it, exclude GDPR special-category data, and do not treat social networks as external sources.",
      "open_credit_relationship": "direct",
      "open_credit_evidence": [
        "Record the source document for each critical fact.",
        "Restrict materiality rules to decision-relevant economic and financial information.",
        "Flag prohibited source or data categories before processing."
      ],
      "finos_controls": ["FINOS-AIGF-MI-1", "FINOS-AIGF-MI-4", "FINOS-AIGF-MI-5"],
      "eu_ai_act_refs": ["Article 9", "Article 10", "Article 12"],
      "official_sources": [
        {
          "label": "Legislative Decree 212/2025",
          "url": "https://www.normattiva.it/atto/caricaDettaglioAtto?atto.codiceRedazionale=26G00009&atto.dataPubblicazioneGazzetta=2026-01-09&tipoDettaglio=multivigenza",
          "publisher": "Normattiva"
        }
      ]
    },
    {
      "id": "IT-TUB-124-BIS-1-TER",
      "title": "Documented and updated assessment procedures",
      "citation": "D.Lgs. 385/1993 (TUB), Article 124-bis(1-ter)",
      "category": "creditworthiness",
      "status": "transition",
      "applicability": "Lenders carrying out consumer creditworthiness assessments.",
      "obligation": "Develop, document, and keep creditworthiness-assessment procedures and the information used by those procedures up to date.",
      "open_credit_relationship": "direct",
      "open_credit_evidence": [
        "Version materiality rules and checker logic.",
        "Record the rule and checker version on each evidence report.",
        "Maintain a change history and periodic review record."
      ],
      "finos_controls": ["FINOS-AIGF-MI-4", "FINOS-AIGF-MI-5"],
      "eu_ai_act_refs": ["Article 9", "Article 11", "Article 12"],
      "official_sources": [
        {
          "label": "Legislative Decree 212/2025",
          "url": "https://www.normattiva.it/atto/caricaDettaglioAtto?atto.codiceRedazionale=26G00009&atto.dataPubblicazioneGazzetta=2026-01-09&tipoDettaglio=multivigenza",
          "publisher": "Normattiva"
        }
      ]
    },
    {
      "id": "IT-TUB-124-BIS-2-BIS-A",
      "title": "Explanation of automated creditworthiness assessment",
      "citation": "D.Lgs. 385/1993 (TUB), Article 124-bis(2-bis)(a)",
      "category": "automated_decisioning",
      "status": "transition",
      "applicability": "A creditworthiness assessment based even partly on automated processing of the consumer's personal data.",
      "obligation": "On request, provide a clear and understandable explanation of the creditworthiness assessment, including the logic and risks of the automated processing and its significance and effects on the decision.",
      "open_credit_relationship": "direct",
      "open_credit_evidence": [
        "Preserve the observed facts used in the internal summary.",
        "Separate observed facts from inferences.",
        "Provide traceable supporting evidence for a lender-created explanation."
      ],
      "finos_controls": ["FINOS-AIGF-MI-4", "FINOS-AIGF-MI-11"],
      "eu_ai_act_refs": ["Article 13", "Article 14", "Article 86"],
      "official_sources": [
        {
          "label": "Legislative Decree 212/2025",
          "url": "https://www.normattiva.it/atto/caricaDettaglioAtto?atto.codiceRedazionale=26G00009&atto.dataPubblicazioneGazzetta=2026-01-09&tipoDettaglio=multivigenza",
          "publisher": "Normattiva"
        }
      ],
      "notes": "OpenCredit's internal completeness report is supporting evidence, not the legally required consumer-facing explanation."
    },
    {
      "id": "IT-TUB-124-BIS-2-BIS-B",
      "title": "Consumer opportunity to express a view",
      "citation": "D.Lgs. 385/1993 (TUB), Article 124-bis(2-bis)(b)",
      "category": "automated_decisioning",
      "status": "transition",
      "applicability": "A creditworthiness assessment based even partly on automated processing of the consumer's personal data.",
      "obligation": "Allow the consumer to express their view to the lender.",
      "open_credit_relationship": "supporting",
      "open_credit_evidence": [
        "Link consumer-provided corrections or context to the case evidence.",
        "Re-run materiality checks when relevant source information changes."
      ],
      "finos_controls": ["FINOS-AIGF-MI-11"],
      "eu_ai_act_refs": ["Article 14", "Article 26"],
      "official_sources": [
        {
          "label": "Legislative Decree 212/2025",
          "url": "https://www.normattiva.it/atto/caricaDettaglioAtto?atto.codiceRedazionale=26G00009&atto.dataPubblicazioneGazzetta=2026-01-09&tipoDettaglio=multivigenza",
          "publisher": "Normattiva"
        }
      ]
    },
    {
      "id": "IT-TUB-124-BIS-2-BIS-C",
      "title": "Human reconsideration of assessment and decision",
      "citation": "D.Lgs. 385/1993 (TUB), Article 124-bis(2-bis)(c)",
      "category": "automated_decisioning",
      "status": "transition",
      "applicability": "A creditworthiness assessment based even partly on automated processing of the consumer's personal data.",
      "obligation": "Provide a route for reconsideration by the lender of both the creditworthiness assessment and the credit-granting decision.",
      "open_credit_relationship": "supporting",
      "open_credit_evidence": [
        "Show the reviewer the checked summary, omissions, and source evidence.",
        "Record the human outcome, override, reason, and timestamp."
      ],
      "finos_controls": ["FINOS-AIGF-MI-4", "FINOS-AIGF-MI-11"],
      "eu_ai_act_refs": ["Article 14", "Article 26"],
      "official_sources": [
        {
          "label": "Legislative Decree 212/2025",
          "url": "https://www.normattiva.it/atto/caricaDettaglioAtto?atto.codiceRedazionale=26G00009&atto.dataPubblicazioneGazzetta=2026-01-09&tipoDettaglio=multivigenza",
          "publisher": "Normattiva"
        }
      ]
    },
    {
      "id": "IT-TUB-124-BIS-2-TER",
      "title": "Third-party explanation information",
      "citation": "D.Lgs. 385/1993 (TUB), Article 124-bis(2-ter)",